File Name,Main mission,Sub mission,Academic Summary,Link sub folder
รวมบทความการประเมินแบบบูรณาการเพื่อรองรับ CBE.pdf,กลุ่มที่ 1: การพัฒนานวัตกรรมและองค์ความรู้เฉพาะทางในการนิเทศการศึกษา,1.2 เครื่องมือการวัดและประเมินผลต้นแบบ,นวัตกรรมต้นแบบแนวทางการประเมินผลข้ามศาสตร์เพื่อรองรับการศึกษาฐานสมรรถนะ (CBE) โดยใช้สถานการณ์จริงรอบตัวและคำค้นหายอดนิยมจาก Google Trends มาเป็นสิ่งเร้า มุ่งลดภาระการประเมินของครูและนักเรียน,https://drive.google.com/drive/folders/1nE74WgwPM3qwR5Z9KMP_1XUyYnYfZFMu?usp=sharing
รวมบทความการวัดผลแบบบูรณาการข้ามศาสตร์.pdf,กลุ่มที่ 1: การพัฒนานวัตกรรมและองค์ความรู้เฉพาะทางในการนิเทศการศึกษา,1.2 เครื่องมือการวัดและประเมินผลต้นแบบ,การพัฒนากรอบแนวคิดและเครื่องมือต้นแบบการวัดประเมินผลการเรียนรู้ข้ามศาสตร์ในสถานการณ์ที่ไม่คุ้นเคย เชื่อมโยงบริบทสังคม เทรนด์ออนไลน์ และการประเมินตามสภาพจริง เพื่อช่วยลดภาระงานควบคู่กับการพัฒนาผู้เรียน,https://drive.google.com/drive/folders/1nE74WgwPM3qwR5Z9KMP_1XUyYnYfZFMu?usp=sharing
รวมบทความนานาทัศนะการศึกษาฐานสมรรถนะ.pdf,กลุ่มที่ 1: การพัฒนานวัตกรรมและองค์ความรู้เฉพาะทางในการนิเทศการศึกษา,"1.1 เอกสารวิชาการประเภท ""คู่มือและแนวทางการนิเทศ""",หนังสือรวบรวม 6 ทัศนะและมุมมองเชิงวิชาการด้านการออกแบบการศึกษาฐานสมรรถนะ ครอบคลุมทั้งด้านหลักสูตร การจัดการเรียนรู้ และการประเมินผลที่เน้นสถานการณ์รอบตัวผู้เรียน เพื่อเป็นแนวทางปฏิรูปห้องเรียน,https://drive.google.com/drive/folders/1rMBq7XiQFJBOZsH7W5O8Ys1MwdYDbU3K?usp=sharing
รวมเล่ม data driven education.pdf,กลุ่มที่ 1: การพัฒนานวัตกรรมและองค์ความรู้เฉพาะทางในการนิเทศการศึกษา,"1.1 เอกสารวิชาการประเภท ""คู่มือและแนวทางการนิเทศ""",คู่มือเชิงแนวคิดและกระบวนการสำหรับครูในการนำข้อมูลสารสนเทศมาใช้ตัดสินใจเพื่อพัฒนาคุณภาพการศึกษา (Data-Driven Decisions) ครอบคลุมการเก็บ วิเคราะห์ และรายงานผลเพื่อยกระดับผลสัมฤทธิ์อย่างเป็นระบบ,https://drive.google.com/drive/folders/1rMBq7XiQFJBOZsH7W5O8Ys1MwdYDbU3K?usp=sharing
รวมเล่ม education taxonomy final.pdf,กลุ่มที่ 1: การพัฒนานวัตกรรมและองค์ความรู้เฉพาะทางในการนิเทศการศึกษา,"1.1 เอกสารวิชาการประเภท ""คู่มือและแนวทางการนิเทศ""","เอกสารวิชาการจำแนกหมวดหมู่และอนุกรมวิธานสำคัญทางการศึกษา (เช่น Bloom, Marzano, Webb's DOK) เพื่อเป็นกรอบแนวคิดให้ครูนำไปประยุกต์ใช้ในการจัดพฤติกรรมการเรียนรู้และการสร้างข้อสอบวัดคิดขั้นสูง",https://drive.google.com/drive/folders/1rMBq7XiQFJBOZsH7W5O8Ys1MwdYDbU3K?usp=sharing
รวมเล่ม ลุก รับ เรียน รู้.pdf,กลุ่มที่ 4: การพัฒนาระบบนิเวศการเรียนรู้ดิจิทัลและเทคโนโลยีสารสนเทศเพื่อการนิเทศการศึกษา,4.1 เอกสารวิชาการและสื่อการเรียนรู้ดิจิทัลในรูปแบบไฟล์คงรูป (PDF/e-Book),"นวัตกรรมการจัดการความรู้ (KM) ของศึกษานิเทศก์ในบทบาท ""นักเล่าเรื่อง"" ผ่านแพลตฟอร์มโซเชียลมีเดีย เพื่อเปลี่ยนผ่านความรู้ ""จากกระดาษสู่อากาศ"" หนุนเสริมให้ครูเกิดการเรียนรู้ร่วมกันแบบยืดหยุ่น",https://drive.google.com/drive/folders/1k0eNO-0kkMyYEvHbEJ12LLxqDdEujTCW?usp=sharing
รวมเล่มนิเทศการณ์ ปก 5.pdf,กลุ่มที่ 1: การพัฒนานวัตกรรมและองค์ความรู้เฉพาะทางในการนิเทศการศึกษา,"1.1 เอกสารวิชาการประเภท ""คู่มือและแนวทางการนิเทศ""",หนังสือรวมบทความวิชาการด้านการวัดประเมินผลและการวิจัยในชั้นเรียนบนฐานคิด Assessment for Learning เพื่อเป็นแหล่งเรียนรู้ทางไกลช่วยลดความเหลื่อมล้ำในการเข้าถึงองค์ความรู้ของครูในพื้นที่ห่างไกล,https://drive.google.com/drive/folders/1rMBq7XiQFJBOZsH7W5O8Ys1MwdYDbU3K?usp=sharing
รวมเล่มบันทึกใน FB.pdf,กลุ่มที่ 4: การพัฒนาระบบนิเวศการเรียนรู้ดิจิทัลและเทคโนโลยีสารสนเทศเพื่อการนิเทศการศึกษา,4.1 เอกสารวิชาการและสื่อการเรียนรู้ดิจิทัลในรูปแบบไฟล์คงรูป (PDF/e-Book),"การสกัดองค์ความรู้และเครื่องมือดิจิทัล (เช่น Google Forms, Looker Studio) จากการบันทึกประสบการณ์ผ่าน Facebook ของศึกษานิเทศก์ เพื่อสร้างระบบสารสนเทศอัจฉริยะและกระตุ้นการปฏิรูปห้องเรียนฐานสมรรถนะ",https://drive.google.com/drive/folders/1k0eNO-0kkMyYEvHbEJ12LLxqDdEujTCW?usp=sharing
แนวทางการเขียนรายงานวิจัย ขั้นพื้นฐาน.pdf,กลุ่มที่ 1: การพัฒนานวัตกรรมและองค์ความรู้เฉพาะทางในการนิเทศการศึกษา,"1.1 เอกสารวิชาการประเภท ""คู่มือและแนวทางการนิเทศ""",คู่มือและแนวทางวิชาการที่สกัดจากประสบการณ์ตรง เพื่อเป็นเข็มทิศนำทางให้แก่ครูผู้สอนระดับขั้นพื้นฐานในการเขียนรายงานการวิจัยในชั้นเรียนอย่างถูกต้องตามหลักเกณฑ์และเป็นระบบ,https://drive.google.com/drive/folders/1rMBq7XiQFJBOZsH7W5O8Ys1MwdYDbU3K?usp=sharing
แนวทางการเขียนรายงานวิจัย ปฐมวัย.pdf,กลุ่มที่ 1: การพัฒนานวัตกรรมและองค์ความรู้เฉพาะทางในการนิเทศการศึกษา,"1.1 เอกสารวิชาการประเภท ""คู่มือและแนวทางการนิเทศ""",เอกสารแนวทางการจัดทำและเขียนรายงานการวิจัยในชั้นเรียนที่ออกแบบมาเฉพาะสำหรับครูปฐมวัย เพื่อเป็นเครื่องมือในการสืบเสาะความจริงและแก้ปัญหาพัฒนาการเด็กอย่างเป็นระบบและเชื่อถือได้,https://drive.google.com/drive/folders/1rMBq7XiQFJBOZsH7W5O8Ys1MwdYDbU3K?usp=sharing
รวมเล่ม AL 2568.pdf,กลุ่มที่ 1: การพัฒนานวัตกรรมและองค์ความรู้เฉพาะทางในการนิเทศการศึกษา,1.3 รายงานการวิจัยและพัฒนา (R&D) ในบทบาทศึกษานิเทศก์,รายงานการวิจัยเชิงสำรวจเพื่อสกัดและตรวจสอบองค์ประกอบและพฤติกรรมบ่งชี้ในการจัดกิจกรรม Active Learning ของครูผู้สอนจังหวัดเชียงใหม่ ปี 2568 เพื่อใช้เป็นกรอบมาตรฐานในการประเมินและนิเทศการศึกษา,https://drive.google.com/drive/folders/1UHau5Y_tZk2yz4wGd-EyCgdYwyLbOyIp?usp=sharing
รวมเล่ม Canva v 2.pdf,กลุ่มที่ 4: การพัฒนาระบบนิเวศการเรียนรู้ดิจิทัลและเทคโนโลยีสารสนเทศเพื่อการนิเทศการศึกษา,4.3 คู่มือและรายงานการประเมินผลการใช้เทคโนโลยีดิจิทัล (สถิติการใช้งาน/คู่มือผู้ใช้ระบบ),คู่มือเทคนิคการประยุกต์ใช้แพลตฟอร์ม Canva for Education สำหรับครูผู้สอน เพื่อการออกแบบการเรียนการสอน การสื่อสารในการนิเทศการศึกษา และการจัดกิจกรรมส่งเสริมทักษะการคิดขั้นสูงของผู้เรียน,https://drive.google.com/drive/folders/1_MewmqiZ2ca1qG0rkFYMKFbCIOVLA6b7?usp=sharing
รวมเล่ม GDS.pdf,กลุ่มที่ 4: การพัฒนาระบบนิเวศการเรียนรู้ดิจิทัลและเทคโนโลยีสารสนเทศเพื่อการนิเทศการศึกษา,4.2 การพัฒนาระบบอัตโนมัติและเครื่องมือช่วยปฏิบัติงาน (การเขียนสคริปต์/โค้ด/ระบบอัตโนมัติ),คู่มืออธิบายการใช้งาน Google Data Studio (GDS) แบบ Step-by-Step สำหรับผู้บริหารและครู เพื่อพัฒนาคุณภาพการศึกษาและระบบบริหารจัดการสถานศึกษาโดยใช้สารสนเทศและการขับเคลื่อนด้วยข้อมูล,https://drive.google.com/drive/folders/12npSm4gurZQZymD0KIj0syAIRYTQiEF1?usp=sharing
รวมเล่ม Innovator to innovation final.pdf,กลุ่มที่ 1: การพัฒนานวัตกรรมและองค์ความรู้เฉพาะทางในการนิเทศการศึกษา,1.2 เครื่องมือการวัดและประเมินผลต้นแบบ,"รายงานการวิจัยและพัฒนาเครื่องมือต้นแบบ ""แบบประเมินคุณลักษณะนวัตกร"" สำหรับนักเรียนชั้นมัธยมศึกษาตอนต้นในจังหวัดเชียงใหม่ โดยผ่านการตรวจสอบคุณภาพพฤติกรรมบ่งชี้ทั้ง 7 ด้านอย่างเป็นวิทยาศาสตร์",https://drive.google.com/drive/folders/1nE74WgwPM3qwR5Z9KMP_1XUyYnYfZFMu?usp=sharing
รวมเล่ม LDS v.2.pdf,กลุ่มที่ 4: การพัฒนาระบบนิเวศการเรียนรู้ดิจิทัลและเทคโนโลยีสารสนเทศเพื่อการนิเทศการศึกษา,4.2 การพัฒนาระบบอัตโนมัติและเครื่องมือช่วยปฏิบัติงาน (การเขียนสคริปต์/โค้ด/ระบบอัตโนมัติ),คู่มือการประยุกต์ใช้ Looker Studio (ฉบับปรับปรุงครั้งที่ 2) สำหรับผู้บริหารและครู เพื่อเปลี่ยนข้อมูลดิบให้เป็นแดชบอร์ดสารสนเทศอัจฉริยะ นำไปสู่การบริหารจัดการห้องเรียนและสถานศึกษาโดยใช้สารสนเทศเป็นฐาน,https://drive.google.com/drive/folders/12npSm4gurZQZymD0KIj0syAIRYTQiEF1?usp=sharing
รวมเล่ม NT คณิตศาสตร์ 63 64 65.pdf,กลุ่มที่ 1: การพัฒนานวัตกรรมและองค์ความรู้เฉพาะทางในการนิเทศการศึกษา,1.2 เครื่องมือการวัดและประเมินผลต้นแบบ,คลังเครื่องมือและแนวทางการจัดกลุ่มข้อสอบ NT ด้านคณิตศาสตร์ (ปี 2563-2565) แยกตามมาตรฐานและตัวชี้วัด เพื่อให้ครูและนักเรียนชั้นประถมศึกษาปีที่ 3 ใช้สร้างความคุ้นเคยและวางแผนพัฒนาสมรรถภาพรายบุคคล,https://drive.google.com/drive/folders/1nE74WgwPM3qwR5Z9KMP_1XUyYnYfZFMu?usp=sharing
รวมเล่ม NT ภาษาไทย 63 64 65.pdf,กลุ่มที่ 1: การพัฒนานวัตกรรมและองค์ความรู้เฉพาะทางในการนิเทศการศึกษา,1.2 เครื่องมือการวัดและประเมินผลต้นแบบ,การสกัดและจำแนกกลุ่มแบบทดสอบ NT วิชาภาษาไทย (ปี 2563-2565) ของนักเรียนชั้นประถมศึกษาปีที่ 3 ตามโครงสร้างตัวชี้วัด เพื่อเป็นเครื่องมือต้นแบบให้ครูนำไปวิเคราะห์และออกแบบกิจกรรมซ่อมเสริมได้ตรงจุด,https://drive.google.com/drive/folders/1nE74WgwPM3qwR5Z9KMP_1XUyYnYfZFMu?usp=sharing
รวมเล่ม onet 65 66 67.pdf,กลุ่มที่ 3: การบริหารจัดการเครือข่ายและประสานความร่วมมือเพื่อการพัฒนาการศึกษาเชิงพื้นที่,3.3 รายงานผลการดำเนินงานเชิงระบบและสารสนเทศเพื่อการตัดสินใจของผู้บริหาร,รายงานวิเคราะห์เชิงระบบสารสนเทศจากผลการทดสอบ O-NET (ป.6 และ ม.3) ปี 2565-2567 บนฐานคิด Assessment for Learning เพื่อชี้เป้ามาตรฐานที่ควรเร่งพัฒนา ให้ผู้บริหารใช้ตัดสินใจเชิงนโยบายในพื้นที่จังหวัดเชียงใหม่,https://drive.google.com/drive/folders/1P1-_72U1bdp1cBKSatDVPX91_HLPRCE6?usp=sharing
รวมเล่มการวิเคราะห์มาตรฐานการเรียนรู้เอกชน ท้องถิ่น 2566.pdf,กลุ่มที่ 3: การบริหารจัดการเครือข่ายและประสานความร่วมมือเพื่อการพัฒนาการศึกษาเชิงพื้นที่,3.3 รายงานผลการดำเนินงานเชิงระบบและสารสนเทศเพื่อการตัดสินใจของผู้บริหาร,"รายงานวิจัยเชิงระบบสารสนเทศที่ใช้ ""พื้นที่เป็นฐาน"" โดยวิเคราะห์ผลสอบ O-NET ปี 2566 ของโรงเรียนเอกชนและท้องถิ่นในจังหวัดเชียงใหม่ แยกตามมาตรฐานเพื่อชี้เป้าให้ผู้บริหารใช้ตัดสินใจขับเคลื่อนนโยบาย",https://drive.google.com/drive/folders/1P1-_72U1bdp1cBKSatDVPX91_HLPRCE6?usp=sharing
รวมเล่มกิจกรรมพัฒนาพหุปัญญา ป.4-ป.6 ครูสร้าง final.pdf,กลุ่มที่ 1: การพัฒนานวัตกรรมและองค์ความรู้เฉพาะทางในการนิเทศการศึกษา,1.2 เครื่องมือการวัดและประเมินผลต้นแบบ,นวัตกรรมชุดเครื่องมือและกิจกรรมประเมินพหุปัญญา (Multiple Intelligences) ที่ผ่านการวิจัยเชิงระบบและสกัดพฤติกรรมบ่งชี้ให้สอดคล้องกับวิถีชีวิตและบริบททางวัฒนธรรมของจังหวัดเชียงใหม่,https://drive.google.com/drive/folders/1nE74WgwPM3qwR5Z9KMP_1XUyYnYfZFMu?usp=sharing
รวมเล่มตัวชี้วัด Onet 2565.pdf,กลุ่มที่ 3: การบริหารจัดการเครือข่ายและประสานความร่วมมือเพื่อการพัฒนาการศึกษาเชิงพื้นที่,3.3 รายงานผลการดำเนินงานเชิงระบบและสารสนเทศเพื่อการตัดสินใจของผู้บริหาร,การรวบรวมและวิเคราะห์สารสนเทศตัวชี้วัดที่ใช้ในข้อสอบ O-NET ปี 2565 (ป.6 และ ม.3) เพื่อเป็นเครื่องมือให้เครือข่ายครูผู้สอนใช้มองเห็นภาพรวมและวางแผนพัฒนาคุณภาพการจัดการเรียนรู้ร่วมกัน,https://drive.google.com/drive/folders/1P1-_72U1bdp1cBKSatDVPX91_HLPRCE6?usp=sharing
รวมเล่มทบทวนความรู้การวิจัยในชั้นเรียน.pdf,กลุ่มที่ 2: การพัฒนาวิชาชีพและหนุนเสริมศักยภาพครูผ่านกระบวนการนิเทศแบบร่วมมือ,2.1 หลักสูตรและสื่อการพัฒนาวิชาชีพครู (เช่น เอกสารประกอบการจัดเวิร์กชอป),สื่อสรุปองค์ความรู้และแบบทดสอบทบทวนเรื่องการวิจัยในชั้นเรียน (ฉบับคนเริ่มต้น) เพื่อใช้หนุนเสริมสมรรถนะครูในการวิเคราะห์ปัญหาห้องเรียนและสร้างนวัตกรรมแก้ไขพฤติกรรมผู้เรียนได้อย่างเป็นระบบ,https://drive.google.com/drive/folders/1XTdr4mmlwkj8wnRVMpYYiECGwHSYoY4H?usp=sharing
รวมเล่มแนวทางการเขียนรายงานการวิจัยในชั้นเรียน เอกชน.pdf,กลุ่มที่ 1: การพัฒนานวัตกรรมและองค์ความรู้เฉพาะทางในการนิเทศการศึกษา,"1.1 เอกสารวิชาการประเภท ""คู่มือและแนวทางการนิเทศ""",คู่มือและแนวทางวิชาการที่ออกแบบมาจำเพาะสำหรับครูโรงเรียนเอกชน เพื่อใช้เป็นเข็มทิศและกรอบมาตรฐานในการเขียนรายงานวิจัยในชั้นเรียนให้ถูกต้อง น่าเชื่อถือ และสอดคล้องกับเกณฑ์การพัฒนาวิชาชีพ,https://drive.google.com/drive/folders/1rMBq7XiQFJBOZsH7W5O8Ys1MwdYDbU3K?usp=sharing
รวมเล่มเปรียบเทียบมาตรฐานการเรียนรู้ 2565.pdf,กลุ่มที่ 3: การบริหารจัดการเครือข่ายและประสานความร่วมมือเพื่อการพัฒนาการศึกษาเชิงพื้นที่,3.3 รายงานผลการดำเนินงานเชิงระบบและสารสนเทศเพื่อการตัดสินใจของผู้บริหาร,งานวิจัยเปรียบเทียบคะแนนเฉลี่ยร้อยละตามมาตรฐานการเรียนรู้จากผลสอบ O-NET ปี 2565 ของจังหวัดเชียงใหม่ เพื่อสกัดเป็นสารสนเทศเชิงลึกให้สถานศึกษาและผู้บริหารใช้ชี้เป้าจุดที่ต้องเร่งพัฒนาพัฒนาเชิงพื้นที่,https://drive.google.com/drive/folders/1P1-_72U1bdp1cBKSatDVPX91_HLPRCE6?usp=sharing
